[
  {
    "id": "rabota-by-intern-list",
    "type": "internship",
    "title": "Стажировки программистом (подборка rabota.by)",
    "date": "2026-07-31",
    "date_end": null,
    "location": "Минск",
    "tags": ["internship", "junior", "python", "java", "minsk"],
    "url": "https://rabota.by/stazhirovki/programmist",
    "source": "manual_feed",
    "source_url": "https://rabota.by/stazhirovki/programmist",
    "fetched_at": "2026-07-31T13:00:00+03:00"
  },
  {
    "id": "rabota-by-qa-intern",
    "type": "internship",
    "title": "Стажировки QA / тестирование (rabota.by)",
    "date": "2026-07-31",
    "date_end": null,
    "location": "Минск",
    "tags": ["internship", "junior", "qa", "minsk"],
    "url": "https://rabota.by/stazhirovki?q=QA",
    "source": "manual_feed",
    "source_url": "https://rabota.by/stazhirovki",
    "fetched_at": "2026-07-31T13:00:00+03:00"
  },
  {
    "id": "tg-belarus-it-want",
    "type": "internship",
    "title": "Belarus: хочу в IT — стажировки, курсы, вакансии",
    "date": "2026-07-31",
    "date_end": null,
    "location": "online",
    "tags": ["internship", "junior", "meetup", "telegram", "minsk"],
    "url": "https://t.me/belarusitwant",
    "source": "manual_feed",
    "source_url": "https://t.me/belarusitwant",
    "fetched_at": "2026-07-31T13:00:00+03:00"
  },
  {
    "id": "meetup-aston-telegram",
    "type": "meetup",
    "title": "ASTON — анонсы митапов и IT-событий",
    "date": null,
    "date_end": null,
    "location": "Минск / online",
    "tags": ["meetup", "junior", "qa", "telegram", "minsk", "online"],
    "url": "https://t.me/astonit",
    "source": "manual_feed",
    "source_url": "https://career.astondevs.ru/newsletter",
    "fetched_at": "2026-07-31T13:00:00+03:00"
  },
  {
    "id": "meetup-andersen-telegram",
    "type": "meetup",
    "title": "Andersen People — митапы, воркшопы, стажировки",
    "date": null,
    "date_end": null,
    "location": "Минск / online",
    "tags": ["meetup", "junior", "qa", "python", "telegram", "minsk", "online"],
    "url": "https://t.me/andersen_people",
    "source": "manual_feed",
    "source_url": "https://people.andersenlab.com/meetups-with-andersen-recaps",
    "fetched_at": "2026-07-31T13:00:00+03:00"
  },
  {
    "id": "meetup-itacademy-telegram",
    "type": "meetup",
    "title": "IT-Academy — анонсы митапов и мероприятий",
    "date": null,
    "date_end": null,
    "location": "Минск / online",
    "tags": ["meetup", "junior", "qa", "telegram", "minsk", "online"],
    "url": "https://t.me/it_academy_by",
    "source": "manual_feed",
    "source_url": "https://www.it-academy.by/media/sobytiya/",
    "fetched_at": "2026-07-31T13:00:00+03:00"
  },
  {
    "id": "meetup-itacademy-events",
    "type": "meetup",
    "title": "IT-Academy — календарь событий (сайт)",
    "date": null,
    "date_end": null,
    "location": "Минск / online",
    "tags": ["meetup", "conference", "junior", "minsk", "online"],
    "url": "https://www.it-academy.by/media/sobytiya/",
    "source": "manual_feed",
    "source_url": "https://www.it-academy.by/media/sobytiya/",
    "fetched_at": "2026-07-31T13:00:00+03:00"
  },
  {
    "id": "meetup-minsk-python",
    "type": "meetup",
    "title": "Minsk Python Meetup — анонсы встреч и нетворкинг",
    "date": null,
    "date_end": null,
    "location": "Минск",
    "tags": ["meetup", "python", "minsk"],
    "url": "https://t.me/minsk_python",
    "source": "manual_feed",
    "source_url": "https://minskpython.github.io/",
    "fetched_at": "2026-07-31T13:00:00+03:00"
  },
  {
    "id": "meetup-minsk-python-jobs",
    "type": "meetup",
    "title": "Minsk Python Jobs — вакансии и нетворкинг питонистов",
    "date": null,
    "date_end": null,
    "location": "Минск / online",
    "tags": ["meetup", "python", "internship", "junior", "telegram", "minsk", "online"],
    "url": "https://t.me/minsk_python_jobs",
    "source": "manual_feed",
    "source_url": "https://t.me/minsk_python",
    "fetched_at": "2026-07-31T13:00:00+03:00"
  },
  {
    "id": "meetup-minsk-python-talks",
    "type": "meetup",
    "title": "Minsk Python — заявки на доклады (сообщество)",
    "date": null,
    "date_end": null,
    "location": "Минск",
    "tags": ["meetup", "python", "minsk"],
    "url": "https://github.com/minskpython/talks/issues",
    "source": "manual_feed",
    "source_url": "https://minskpython.github.io/",
    "fetched_at": "2026-07-31T13:00:00+03:00"
  },
  {
    "id": "meetup-belarus-it-events",
    "type": "meetup",
    "title": "Belarus: хочу в IT — анонсы митапов и мероприятий",
    "date": null,
    "date_end": null,
    "location": "Минск / online",
    "tags": ["meetup", "conference", "junior", "telegram", "minsk", "online"],
    "url": "https://t.me/belarusitwant",
    "source": "manual_feed",
    "source_url": "https://t.me/belarusitwant",
    "fetched_at": "2026-07-31T13:00:00+03:00"
  }
]
